{"manifest_version":1,"scope":"explicit_gt_batch","status":"complete","product":"wow_classic_beta","build":70205,"locale":"enUS","extractor":"forever-gt-extract","extractor_version":"0.1.0","oracle_commit":"02245dcd245e7433e524577656177723d3e4992e","plan":"all","numeric_policy":"finite_decimal_f64_to_f32_v1","max_file_bytes":4194304,"max_batch_bytes":25165824,"offline":true,"downloaded_bytes":0,"paths_redacted":true,"full_client_extraction":false,"typed_loaders_executed":false,"artifacts":[{"name":"BaseMp","file_id":1391664,"relative_path":"gt/BaseMp.txt","value_columns":15,"status":"complete","bytes":80,"sha256":"c47885b912f0a4c8a027460ef6dcb7d10d5b3e1656c87f28d1aad678b9196518","data_rows":1,"consumer_rows_including_zero":2,"terminated_early":false,"error_code":null},{"name":"HpPerSta","file_id":1391642,"relative_path":"gt/HpPerSta.txt","value_columns":1,"status":"complete","bytes":10,"sha256":"f8e119f01fd6ac6f88406503156d5aa8c45db3503664d9689f50bbd123edd66b","data_rows":1,"consumer_rows_including_zero":2,"terminated_early":false,"error_code":null},{"name":"xp","file_id":1391661,"relative_path":"gt/xp.txt","value_columns":5,"status":"complete","bytes":30,"sha256":"f690af62715ab1a7bb551e59604897db0505398284eeb5395a9d970c27f67f6a","data_rows":1,"consumer_rows_including_zero":2,"terminated_early":false,"error_code":null},{"name":"SpellScaling","file_id":1391660,"relative_path":"gt/SpellScaling.txt","value_columns":24,"status":"complete","bytes":125,"sha256":"dcd9188112fb5ddcd58d31f6a81988659c59b0f98a8ea38421791d3699971048","data_rows":1,"consumer_rows_including_zero":2,"terminated_early":false,"error_code":null},{"name":"CombatRatingsMultByILvl","file_id":1391670,"relative_path":"gt/CombatRatingsMultByILvl.txt","value_columns":4,"status":"complete","bytes":25,"sha256":"0d3e7071a735a0a1651e9966750dacf1eb31a5910fcdef20c747941cf656fef0","data_rows":1,"consumer_rows_including_zero":2,"terminated_early":false,"error_code":null},{"name":"StaminaMultByILvl","file_id":1980632,"relative_path":"gt/StaminaMultByILvl.txt","value_columns":4,"status":"complete","bytes":25,"sha256":"0d3e7071a735a0a1651e9966750dacf1eb31a5910fcdef20c747941cf656fef0","data_rows":1,"consumer_rows_including_zero":2,"terminated_early":false,"error_code":null}],"integrity":{"file_count":6,"total_bytes":295,"inventory_sha256":"314bc9501196e6845b3cca202ae6a2d8595df6eaf14be370b8efb0192597d2dd"}}
